<?xml version="1.0"?>
<Spots xmlns:xsi="http://www.w3.org/2001/XMLSchema-instance" xsi:schemaLocation="http://venus.eas.asu.edu/WsRepository/xml Spot.xsd">
  <Spot Name="5Rg5vdImOwrFjCRajy0Xn3Trp3TfdWCZ">
    <Location>
      <State>S1l5jqeWSWA=</State>
      <City>5Rg5vdImOwqKKzX1f7V77A==</City>
      <ZipCode>YDwS9w5SIOk=</ZipCode>
    </Location>
    <Introduction>iTr6Mzg3cGXRuAxHbcxela/dzgZWKqKGNOlG1/v2DXaNt/eAdkhlD1WIYk0kIWN/U/mo5vdDqePImhpkX54THANPTfKkwnWLTW9ZfcobdIYk1kaDIQih5mAGWoO6N1gN3m1aejrWj1O3Hug2wpk1X7p2iyOFaK9DyQEl/Me1ZqaOG2GVx6vIJEJ/BwC1+sISCMLMimj/XXdVgO7f1I8vWHePsVIV6k9N9WVBswVbhzpN5T63t4Mv2NF9tjzjNnkeWuXsJOxWLag779XNGpJLGRviZDojERJz0OBuoqFdhBnsm3LvtmBGoR0uCtL5To+xXGsWd39ER8NqTmSQpJl2F8kIjPSAN7WqCyl9gfkmHn8V1FHLGj8MK4zhFAC7GmnAq4OgwDrRrUYKpER7bYqQBAEmBI67R4a+sZLdmDM2zs4kgI2cbJiTBdupXVxC+cQdSl9V4l04rLsLZmSuGQ1SksmNtEwAtOsRn9FZidjb28A=</Introduction>
    <Price>6WJbv1S4DDQ=</Price>
  </Spot>
  <Spot Name="x3nz08qH+FCIALvjcRezWg==">
    <Location>
      <State>CtDkwyzCBHs=</State>
      <City>x3nz08qH+FBnuf6nAqxkkSFDsmlY01oc</City>
      <ZipCode>TSHrvNL1h+o=</ZipCode>
    </Location>
    <Introduction>bObTDTkZDy721+Xr1dnCkGO6N5B5C2rgd2fypUWRZJ64Khoj9D+QE6zXyiSyxxrlzXm8KyMzytLHwh1K0qOxW6W1DIoZK5M8DrqhHMbs/gCYu+NVfDCT0sei4JjNoQw+Y3LS/WJZtT0RUB7RpWF0wFY3MGsQnvDdYFrOFOVJ3Ge9+9eXjDC1V/1D/HPa+7kUPk6+I6TfgG4GhKO3DgTzDu/PNWawGAAuMOwCmHT6N5g+h0mA2yBmYLkEpiIrDI6FM5QvR5e4MHvkmF4J84JV+i0PyygKqVnPB5Gzy67XfCUX6IEv2+4AH4kKy8YjkboFJqZygkVDHl2vKULYwdAnCwU3azivFuEFS4yVz5Q+zNfoDe70wSAu6JFtn+mVcmwMpyyXEeWPVRjwYx3vOszRD9AinNDleTHEb7E60jeUlR5WBE/QUbhXtj5HJt13Fwir6MFFqqhgtX+8MVwc6mzN44SmxDE9V1eVchJssM9pEL6J3f7ReMUIE9y8ZDA+HdZtLswgFcVaGVI=</Introduction>
    <Price>1czN+5B0vS0=</Price>
  </Spot>
  <Spot Name="m8BB9sm7HrD8QOfYQzQcyQ==">
    <Location>
      <State>S1l5jqeWSWA=</State>
      <City>yrIHD7W5VvapYA0tYji3MQ==</City>
      <ZipCode>njQQRMvkscc=</ZipCode>
    </Location>
    <Introduction>ys6lVB6deYJoz/giW5shSjz6v+J9Ltq1+p0SFX0dxkg0nYCg9O74R7NW++VpMir+tC8Sx5ehSf8i+gN8rZzlZwj+BgfOgS+3mIt62kAjEStEbkeqYpeV33GDL1NgoW88hrd9NYVN3EYblg2iM5wLIHTzNqycwCbFkdVtY2en5R+NckggcWvXx6Hfo+WDCn9QjYbmKcBzsumv6ABBHc2mkCOE78b2AbB4a7v1zWx15vSkDssiIpgmrQIBR9jpzElmsdmx6j8xKN4JS1uZTEMubyM/qhmqKdmoykW6BLqB4WCeb3uMya6dHf/V+bfhg4tY0R6q6E4oZX3j/pb1sCFBDAQCqhmHwWuSxYi2MrQroxtRpCXu1dGB1NwOuj0pr1LcvRQvL09UANbTwBcoeMaiC84NoBj04ezRx35lVmiSZjHf7A0I6qBC27vtPbjpeEyq0KRUSxZZOwXV8Ge6h+DAgLniIEHyU7O045A+Hi+toHhdDX4MGCeWcJjt2QhZ/og9BZ9u46Og2TXE/X6zNsoIJttbB/WPQSLdPiA430jyNbTEmvzuXdRn4oWMzgpCFCsBVmEQKc2SZ5r0FLPSvdcxAFah9xkKtTmW</Introduction>
    <Price>+0FbcJkLpRk=</Price>
  </Spot>
  <Spot Name="dYY9l/xFDnktVtIUo3v9mWLcMt54CNpo">
    <Location>
      <State>RcksM13kw+Y=</State>
      <City>dYY9l/xFDnmstD7epFqPDA==</City>
      <ZipCode>AC8yRDYH7qk=</ZipCode>
    </Location>
    <Introduction>ySnmZhkpcdm6CEYgQkyB0lvrHhqfORNnsNHlN1xBegMYY6iWRbsnTWSfUiKTrs8IYMThZHNKxhpqc+TUHIucugsdpIjEWctIKbhQ3bKQCJRYRVG1oneCz8Y2FgrejODqvBXNDXYGG6cOGyYTzv4jXJ9tJFXdZ4on0r0r0hE6S1pkMCzxe3vsza6fhzV/QiwjM6+U764Rwam83Z/qxYiQbLpcmNRRYILxfOVSzATFGSLAlPPYoQV6ORrjomP2rb+gMHO+JDr4DqVtJWu2FWbjeHd2KKUdRFi2hgAAzi5lSA6MBzcWgln6PeUTw1eJjM9O3Wnw5vRJmfrmvGuBEprn+nI6CUOf+g3LWJ105AtS8VMMde8B9xSiZuD00JfjWsc7oUVdYkpGow8iDH5N5OEJ16rl+Ef9xq1wSAUDMB7H28Oi4/OAwCJK3SXJGTpquxfL3cN9PZg/QP8t5ge8hSWLTZ7V1Qxy6xHCfBm8PlcRIPUAE9Z3kOBVml4Z/IdxUoHe2ojYSPMcYnwFvYoquPVp9nsTUyCfJA2UnPMeH0nQCeA=</Introduction>
    <Price>VaIwHI9cWxM=</Price>
  </Spot>
  <Spot Name="CXqF3vmUnsD0blpeQyPksjZlLKetOyEakxB+RKCP0Ks=">
    <Location>
      <State>AavGOWU18+o=</State>
      <City>CXqF3vmUnsD0blpeQyPksjZlLKetOyEakxB+RKCP0Ks=</City>
      <ZipCode>Ym+W14BjkHw=</ZipCode>
    </Location>
    <Introduction>CXqF3vmUnsD0blpeQyPksjZlLKetOyEaOT9ZP1VpbKd4Be9SD9Pe3MVgJCsMVleoEcfXxMgsZO7c8rtsV+ozjxNpMd/I/n1nnmelv74DfGE6DxrHyurw6UZR0GKttLMvLDNxxiKWfJdJMlsqTPekSIuxGwBYQMBHF13NroG9VtT17I5sdFTvqorfaXW6trHwz60OYw2mfcMEImPq3+XVy+JOsqcLNnpZWQadCt4f9oQhWzsanIZCti1IAPuBjHfceBp8kdL3uKiqvuh/aeQCZ0q2QJRnkX5+uBFKsS95lAQF06Bh+LO9ZY9XQuOtB0h7pWmhOsJiFhfzvfrUVuwREHFIDYSOfGbIe5D9LEVysqLfcnTZuW9HzbYgPioDBAUYZGSSoMVT4Fh7kGJiIYPOjefIyS/0vVUQ2021x+aHsJpIjB6uZTBR9+8Q6QvBqKWUbCsvjK5qqyUSE6debjJDpUw+QM69O0Y03jFUeoD6qArTDb4hUR85FfK5PcIEZ6H5ks5xl+st2QFCx9bTZI3OhT/uQuu0oRpEguahrW84msbQUoeJM25gZ9XSzy0qt5scItw2R/If+mSXi4bAwPlGs7G6YvJmWGAa2VzOp+ri0n0sqGrw2fBWMA==</Introduction>
    <Price>6WJbv1S4DDQ=</Price>
  </Spot>
  <Spot Name="v6gMDMrys3UJu9Gop0GjxfNBhOV565JH">
    <Location>
      <State>S1l5jqeWSWA=</State>
      <City>v6gMDMrys3W1ZXQwGkQNqA==</City>
      <ZipCode>lTUPLFfIjvc=</ZipCode>
    </Location>
    <Introduction>v6gMDMrys3UJu9Gop0Gjxfj9ge/yuOgZmBaiqBoCxCnJJFoRvMVosuHliN7TWQBt24zlcZs7UYqIS5Oo+rA8z2lrV0x4u59a+tYaMXmD2NbliJeL0UjAwHnSO09iTvFmWrZVRPfyPw/6ReshW5fge+G1BAcEFww0SJ4Xx9APLi2OPWa4Dh0GkoW9ZODM0Ua9cNM6p1y4MK7ZlpfUsIHJOurlLDdUC6vXPgZAJc1IurOy1UluwekhZDWFmwZj34yp6fD6LirdgrpbYO0kkAA6tLDf+YRWKJH8+c6rpFzzUD53gBwH0MOCL8E3xXXZfhjTivwVi04eltLIDSj1NECIP7e8wp+I45wAS59rykBZcdXn9Wx8MRuFcs7JwlYoxmgKH+Ke7EVCwdnVTJAnpovfdKwcZHLn4REL3CSaIH5Y5ey2Wt8F7qHTyjORJgPCAH0920EEFlgByQiIYx0FmTA9uWo/G2iBN7qkgg4/w6J/XgkONiEA1Lg9GLW2J6LV2XFws4qv7WINvwBglzNBZlKFCZ41pym6poeWEF9GIcNl2NHC1vkU8S0zjNkbA9ukuH/tW/JTP9MrOLkFK+PGBVluliLRoIUkk4c0</Introduction>
    <Price>Hd5IPw5cnY0=</Price>
  </Spot>
  <Spot Name="dAlr8EIrhT5v8ImjvT56runFwZFHa/W8">
    <Location>
      <State>JnC5B3dP/F8=</State>
      <City>jpEMT55e87Q=</City>
      <ZipCode>Yv3zDFp2FiQ=</ZipCode>
    </Location>
    <Introduction>pqjFVYlugqOhT+mdxyQoShiV/s8t4M7UAXLtrngDbPJwS6CX0NVCod+GmPCzQWphI90hIzjd/qXEj2TL25MXtWjQJC/+t5xpE4kjUcCxbxgGdoXNRp+NlPv3STEojB4ZG8DXV+wRnPTT6DvnIzNTFqODf+4+/49+qKWkMRz9lYX6imrQqpvAQWh4Oq60kZRvU0jm3ag6zz6oO5Yx6ua/D8kKrlrP3qkgugDcNbOvRUEiIxev0rvsWKIrvpg2L6COMizrx8yiL4PrF5F3swu7p84UIS20x8u3jvehRuFpeRiFp8ItkYgGMqre8WC3VK4XMRXxE+aMZWdH7OsWNeV+5iAQ/xxrNFjzzL8/k452i1kSMsyKCLKddYszQk/aU1KoStPgnxSQqQ9uVj4a/SqBoUun2y8kl6c/tkGdCzr3uvysBJzFFE8fdglQ1mj+UkV8yWAs+vMS5wiaSvvSDO4mh+3wAgBxq0zZvWM/yhl+y9dzF/QfZI7Yl/IlpuVqYIeypaZI9wgtE7ntf/jPPNzLmKVVANhmVZLgmkSxOozPj97h1k56rChrxnT/Udcu6isxfz8VJ4vvjIhyzhPUL/cllg==</Introduction>
    <Price>k8cMIdyoqMQ=</Price>
  </Spot>
  <Spot Name="pkx1gpCmEFPLovl/lRJjaVTgy6EDBWGh">
    <Location>
      <State>A5UrrbgNTJU=</State>
      <City>APTF9lScUM0L9CvDEkgGoQ==</City>
      <ZipCode>QscKNj1fdLo=</ZipCode>
    </Location>
    <Introduction>pkx1gpCmEFM9V4OFGmc9StjC1WRaDZi2t5B9Uyj7gR9L6bdo2fFP9QbdHc7M/nIy5VLMXXBXSlVvkq7dCj/m89h7jeQBPibLKSyuVYupqkaG/jnYP1AW8d8wj6y1kfb/W0Ms1WCVGO+KijNaiS9/oY77YxQ/QPd/AbkA9BJQKCqArZqZ4Ez+0VKLruYjFB8gjY/5bbMfvvfC3gw8LLUjM5dBreVGq+9KYsjn+PkdeiQhXrTp87ouaKFVr0BstVQkMSmaf3hR7JnTEHh45bTG6RWqEZYTBwytTbVydguU+pPqcl7rXrIbo18wJOC5sGohooU3RXASfn/fe9KphrIA7c9PzvybcfOOmnFcRllL+sfsTfPYLQJaYAVMyQRvfTg23fqUJeG7Q7edfvNrUVxJ3O6dPuRQ+N+5CzUML4fcK5XzFk1mHU1An6L8ZtYtZ8z3cdw8a/QgEAyb1FjTSg73YLibdbLpOrhY6xSV/J6wX4luDX4S3bLWRtwvhT53EKOl+PBHZBgIfgm8YUP9tNgfjH99FlIHg+wZe3FTm2tx3wzlztUF4FKKUvBq40ochXEstwhr4w/R+JtA7/+9vJlbii5kGkjEBDbzfcH04frZNcY=</Introduction>
    <Price>p6Up1fOf+ao=</Price>
  </Spot>
  <Spot Name="OhOLfdpXpVgjobngqcDhFg==">
    <Location>
      <State>CtDkwyzCBHs=</State>
      <City>5gK9V2Oj5ZsCNU7jmRNOTl/sWO/V+hfg</City>
      <ZipCode>2glZqh3blO8=</ZipCode>
    </Location>
    <Introduction>OhOLfdpXpVhQ8t9Vv7rrwxVc6x1esPPGAMOuhQeV+pdncb6MlE+rTL+K9pv3zChi6rAY47vDBcbncZsE4NCV61t4/6EH7W68H0TN2N/HyYjDdyj92TDa1iwST4jgQud4T4xkqxTzyvwxPVQLw2iU0eS27tgQtbaG7zmmQ9on4O5BIO2WkJzpriM6Vh+62nQezPRC9RgWNZ/A7MMfLYF+2KAG5at76xLvy/3AgpnuubPtfCs+iKLX5u5rT3XaL1hJtaxB/pVREjw4sMUfyclLKRrJQ8g577AJdcqURq8WQT17JZk+T/yq0woB+wjiRXEonZdOt1rny67Q5zHgkfujNA6ssG6DE+7vVNcWo6ASS4VSnvYvmRNCY6KNLRB5anndoWPf8Cj/99oTGbZyCVHrCaOWdltBwSnqSApF60dEl2TULHyO2+7i98YZkooQ/3gSJ5J1ML0IgiMvQyaAaq9Q9ySlJexUDr+tKUuQWHdqfG9wrWLbmDFF33chKsttJTDeMjghfao8KNQ3zJKZblHUenIFH9BfwYDDaxJpumXie+y/My2zhI/jSI5+ws1lLnRr</Introduction>
    <Price>bJrjg0Djr+M=</Price>
  </Spot>
  <Spot Name="gkxM1/kaP2x0WneEN6OjZjWZQIPIK5gPDLoduEDuM5o=">
    <Location>
      <State>RlkdTaVcTy0=</State>
      <City>D8xvahGlGRdUyKayHTOSJQ==</City>
      <ZipCode>dbv7wWjcIWs=</ZipCode>
    </Location>
    <Introduction>KjF6HQSE0BDrKdeTiNLSrX/iqxRsXxF+i09H5GnWAtNxl0Itzla6l6XVvvJfMHcMh7PTA9IThXZiQRE6qcSLO0WiTXs11L/oR+pz0wGo0VXecQ0njZFDNqhMW4TvOFfraM/HoX9tpDD5AMxNbHyf8tnWa5U0J85ZttF2cIC1ITlawbee1BiqMj9mTihegbqG36USj+WP5fZG6aiv02rLfrC40WAKuP2M5FCqkXFYPMLrDadQw97zzTnjuD7g38N1k1NlhYkKHtWCZLfHhSVXSpXGKoRFf676Ic6LAPObycS3JKZtbw5rzNy+eQ+1kpQF1y1H/31Uuk8awCPIb2kj95rmRN8QGN5sRfqCUJkAr/bvHPsep7lM0DvQnr+W0zC+vmEqjeT3dlH28KjocaN9IBCCg2NWxSNimGbMQGWBU5d5org+V3NQjsPgXhxgePtP/58e/9XdzE3EEDG8hk0G+TGe/utz64ETygEr1MTrQrY5rNBOaMO6XNAigUsOFCFlrq1hlJQo08dZ4PBHboDBOBWiilYRYz4/krrvc+AShmpUO3zL/26bva+2rxbh7jADQHbh6LeoNOA=</Introduction>
    <Price>4qwI1mAnODw=</Price>
  </Spot>
  <Spot Name="7iZCWS+dXnq9Hw1gs5CaCg==">
    <Location>
      <State>wc1l1foK/h0=</State>
      <City>+V47n215iMbevNSTqk3pIg==</City>
      <ZipCode>a4usQLAbuoM=</ZipCode>
    </Location>
    <Introduction>7iZCWS+dXnqHk/qWTJb8jLHVJP9ZbnFyHuFm+uock34GDtjP34qonFgm7iDeG9TPGtcefF6/OLePOJjMFbLr4UZe53j/rrWZ9L/ZIBg1BxK1qiLgDwogFUtUymmZ5FcETI/JUbA9lcif6/tOBvyfRW7lFgtBMnbojVeRN5OMKrEsKRsrkJEz7zNfs1d0dTM814CQxVnW7HYxQyC8FD6iY0nfIewBCbQUKsQ79upIi96PksryPj4/XyNCogf6dT33X4/kWdQZSVTUSZY43ETtMXjVfYx+fihG6nNeN7aCE3++XEL4z0T90TfQR46CS3TU4TbJHpnBW9XVMJSWPkyt+dxgATkCDXSMmHuMRzsMalDhTGSz0iERgYZ1KMue3x/PxWwxJJho5y0YxabbmAnRkkgAgJIhkPM4nh9sqSKfaMfgr0uxmUcLvhT1S6aoeMN1rLgdXnkss32sWyXW94Jv9uF0uE4d/Bwb2Pb1wxUR9PKZpqmlogV7Ha/18uMGQtYTCCQDegmO76MJNQrIL1rWQp3OzwoHmB3FpqNNdzcsy9r1DEdyp7hwDOZDZXaahpfh</Introduction>
    <Price>k8cMIdyoqMQ=</Price>
  </Spot>
  <Spot Name="a6RiZrMCo7Ipo/J3h70ofQ==">
    <Location>
      <State>neT0PPSvZFU=</State>
      <City>pK5lEV6Ry1zCXMDro4FYIg==</City>
      <ZipCode>d6Pih+e1qF4=</ZipCode>
    </Location>